{
  "id": "bun",
  "server": "bun",
  "language": "JavaScript",
  "runtime": "Bun",
  "suite": "http-json",
  "server_command": "bun src/server.js",
  "url": "http://206.223.228.93:8080/json",
  "urls": [
    "http://206.223.228.93:8080/json",
    "http://206.223.228.93:8081/json",
    "http://206.223.228.93:8082/json",
    "http://206.223.228.93:8083/json"
  ],
  "connections": 100000,
  "connection_targets": [
    1000,
    10000,
    50000,
    100000
  ],
  "payload_bytes": 256,
  "target_requests_per_second": 10000,
  "target_messages_per_second": 10000,
  "target_connection_rate": 10000,
  "baseline_seconds": 10,
  "settle_seconds": 10,
  "stabilize_seconds": 10,
  "traffic_seconds": 20,
  "cooldown_seconds": 20,
  "started_at": "2026-06-14T16:31:04Z",
  "git_commit": "1baa731",
  "benchmark_recommendations": {
    "topology": "dedicated Latitude server host plus dedicated Latitude loadgen host in the same site",
    "request_shape": "HTTP/1.1 keep-alive POST /json with JSON parse, validation, checksum, and JSON response serialization",
    "primary_metrics": [
      "active_connections",
      "requests_started_per_second",
      "responses_completed_per_second",
      "rss_mb",
      "cpu_percent",
      "threads",
      "open_fds"
    ],
    "notes": [
      "Load generation is isolated from the measured server host.",
      "Connections are distributed over multiple server ports to avoid client ephemeral-port exhaustion at 100k connections.",
      "Connection targets are cumulative inside one continuous run so resource growth can be correlated with server activity."
    ]
  },
  "infrastructure": {
    "provider": "latitude.sh",
    "site": "ASH",
    "server_plan": "f4-metal-small",
    "loadgen_plan": "f4-metal-small",
    "server_public_ip": "206.223.228.93",
    "loadgen_public_ip": "45.250.254.135"
  }
}
